15.01.1966	The First Nigerian Republic, led by Abubakar Tafawa Balewa is overthrown in a military coup d'état.	The First Republic was the republican government of Nigeria between 1963 and 1966 governed by the first republican constitution. The country's government was based on a federal form of the Westminster system. The period between 1 October 1960, when the country gained its independence and 15 January 1966, when the first military coup d’état took place, is also generally referred to as the First Republic. The first Republic of Nigeria was ruled by different leaders representing their regions as premiers in a federation during this period.
15.01.1962	The Derveni papyrus, Europe's oldest surviving manuscript dating to 340 BC, is found in northern Greece.	"The Derveni papyrus is an Ancient Greek papyrus roll that was discovered in 1962 at the archaeological site of Derveni, near Thessaloniki, in Central Macedonia. A philosophical treatise, the text is an allegorical commentary on an Orphic poem, a theogony concerning the birth of the gods, produced in the circle of the philosopher Anaxagoras. The roll dates to around 340 BC, during the reign of Philip II of Macedon, making it Europe's oldest surviving manuscript. The poem itself was originally composed near the end of the 5th century BC, and ""in the fields of Greek religion, the sophistic movement, early philosophy, and the origins of literary criticism it is unquestionably the most important textual discovery of the 20th century."" While interim editions and translations were published over the subsequent years, the manuscript in its entirety was first published in 2006."
15.01.1962	Netherlands New Guinea Conflict: Indonesian Navy fast patrol boat RI Macan Tutul commanded by Commodore Yos Sudarso sunk in Arafura Sea by the Dutch Navy.	Dutch New Guinea or Netherlands New Guinea was the western half of the island of New Guinea that was a part of the Dutch East Indies until 1949, later an overseas territory of the Kingdom of the Netherlands from 1949 to 1962. It contained what are now Indonesia's six easternmost provinces, Central Papua, Highland Papua, Papua, South Papua, Southwest Papua, and West Papua, which were administered as a single province prior to 2003 under the name Irian Jaya, and now comprise the Papua region of the country.
15.01.1949	Chinese Civil War: The Communist forces take over Tianjin from the Nationalist government.	The Chinese Civil War was fought between the Kuomintang-led government of the Republic of China and the forces of the Chinese Communist Party (CCP). Armed conflict continued intermittently from 1 August 1927 until Communist victory resulted in their total control over mainland China on 10 December 1949.
15.01.1947	The Black Dahlia murder: The dismembered corpse of Elizabeth Short was found in Los Angeles.	Elizabeth Short, posthumously known as the Black Dahlia, was an American woman found murdered in the Leimert Park neighborhood of Los Angeles, California, on January 15, 1947. Her case became highly publicized owing to the gruesome nature of the crime, which included the mutilation and bisection of her corpse.
15.01.1943	World War II: The Soviet counter-offensive at Voronezh begins.	World War II or the Second World War was a global conflict between two coalitions: the Allies and the Axis powers. Nearly all of the world's countries participated, with many nations mobilising all resources in pursuit of total war. Tanks and aircraft played major roles, enabling the strategic bombing of cities and delivery of the first and only nuclear weapons ever used in war. World War II is the deadliest conflict in history, causing the death of 70 to 85 million people, more than half of whom were civilians. Millions died in genocides, including the Holocaust, and by massacres, starvation, and disease. After the Allied victory, Germany, Austria, Japan, and Korea were occupied, and German and Japanese leaders were tried for war crimes.
15.01.1943	The Pentagon is dedicated in Arlington County, Virginia.	The Pentagon is the headquarters building of the United States Department of Defense, in Arlington County, Virginia, across the Potomac River from Washington, D.C. The building was constructed on an accelerated schedule during World War II. As a symbol of the U.S. military, the phrase The Pentagon is often used as a metonym for the Department of Defense and its leadership.
15.01.1937	Spanish Civil War: Nationalists and Republicans both withdraw after suffering heavy losses, ending the Second Battle of the Corunna Road.	The Spanish Civil War was fought from 1936 to 1939 between the Republicans and the Nationalists. Republicans were loyal to the left-leaning Popular Front government of the Second Spanish Republic and included socialists, anarchists, communists and separatists. The opposing Nationalists who established the Spanish State were an alliance of fascist Falangists, monarchists, conservatives, and traditionalists supported by Nazi Germany and Fascist Italy and led by a military junta among whom General Francisco Franco quickly achieved a preponderant role. Due to the international political climate at the time, the war was variously viewed as class struggle, a religious struggle, or a struggle between dictatorship and republican democracy, between revolution and counterrevolution, or between fascism and communism. The Nationalists won the war, which ended in early 1939, and ruled Spain until Franco's death in November 1975.
15.01.1936	The first building to be completely covered in glass, built for the Owens-Illinois Glass Company, is completed in Toledo, Ohio.	O-I Glass, Inc. is an American company that specializes in container glass products. It is the largest manufacturer of glass containers in North America, South America, Asia-Pacific and Europe.
15.01.1934	The 8.0 Mw  Nepal–Bihar earthquake strikes Nepal and Bihar with a maximum Mercalli intensity of XI (Extreme), killing an estimated 6,000–10,700 people.	The 1934 Nepal–India earthquake or 1934 Bihar–Nepal earthquake was one of the worst earthquakes in India's history. The towns of Munger and Muzaffarpur were completely destroyed. This 8.0 magnitude earthquake occurred on 15 January 1934 at around 2:13 pm IST and caused widespread damage in northern Bihar and in Nepal.
15.01.1919	Rosa Luxemburg and Karl Liebknecht, two of the most prominent communists in Germany, are clubbed and then shot to death by members of the Freikorps at the end of the Spartacist uprising.	Rosa Luxemburg was a Polish and naturalised-German Marxist theorist and revolutionary socialist. A member of the Social Democracy of the Kingdom of Poland and Lithuania (SDKPiL) and Social Democratic Party of Germany (SPD), she became a leading theorist of the SPD and a prominent figure in the Second International. An anti-imperialist, anti-militarist, and foremost thinker of democracy within the Marxist tradition, she is best known for her major theoretical work, The Accumulation of Capital (1913), and for her revolutionary leadership of the Spartacus League during the German Revolution of 1918–1919.
15.01.1919	Great Molasses Flood: A wave of molasses released from an exploding storage tank sweeps through Boston, Massachusetts, killing 21 and injuring 150.	The Great Molasses Flood, also known as the Boston Molasses Disaster, was a disaster that occurred on Wednesday, January 15, 1919, in the North End neighborhood of Boston, Massachusetts.
15.01.1911	Palestinian Arabic-language Falastin newspaper founded.	Palestinian Arabic or simply Palestinian is a dialect continuum of mutually-intelligible varieties of Levantine Arabic spoken by Palestinians, indigenous to the Palestine region, which includes the states of Palestine, and Israel. It is also spoken by the Palestinian diaspora.
15.01.1910	Construction ends on the Buffalo Bill Dam in Wyoming, United States, which was the highest dam in the world at the time, at 99 m (325 ft).	Buffalo Bill Dam is a concrete arch-gravity dam on the Shoshone River in the U.S. state of Wyoming. Originally 325-foot (99 m), it was the tallest dam in the world when it opened in 1910; a 25-foot (7.6 m) extension was added in 1992 in one of numerous changes and improvements to the structure and its support facilities, which include two full time power generators and two seasonal operations added between 1920 and 1994, and a 2.8-mile (4.5 km) irrigation tunnel completed in 1939.
15.01.1908	The Alpha Kappa Alpha sorority becomes the first Greek-letter organization founded and established by African American college women.	Alpha Kappa Alpha Sorority, Inc. (ΑΚΑ) is an historically African-American sorority. The sorority was founded in 1908 at Howard University in Washington, D.C.. Alpha Kappa Alpha was incorporated in 1913. It is a member of the National Pan-Hellenic Council (NPHC), a group of historically Black fraternities and sororities often called the Divine Nine.
15.01.1892	James Naismith publishes the rules of basketball.	James Naismith was a Canadian-American physical educator, physician, Christian chaplain, and sports coach, best known as the inventor of the game of basketball.
15.01.1889	The Coca-Cola Company, then known as the Pemberton Medicine Company, is incorporated in Atlanta.	The Coca-Cola Company is an American multinational corporation founded in 1892 headquartered in Atlanta, Georgia. It manufactures, sells and markets soft drinks including Coca-Cola, other non-alcoholic beverage concentrates and syrups, and alcoholic beverages. Its stock is listed on the New York Stock Exchange and is a component of the DJIA and the S&P 500 and S&P 100 indices.
15.01.1876	The first newspaper in Afrikaans, Die Afrikaanse Patriot, is published in Paarl.	Afrikaans is a West Germanic language spoken in South Africa, Namibia and to a lesser extent Botswana, Zambia, Zimbabwe and also Argentina where a group in Sarmiento speaks a Patagonian dialect. It evolved from the Dutch vernacular of South Holland spoken by the predominantly Dutch settlers and enslaved population of the Dutch Cape Colony, where it gradually began to develop distinguishing characteristics in the 17th and 18th centuries.
15.01.1870	"Thomas Nast publishes a political cartoon  symbolizing the Democratic Party with a donkey (""A Live Jackass Kicking a Dead Lion"") for Harper's Weekly."	"Thomas Nast was a German-born American caricaturist and editorial cartoonist often considered to be the ""Father of the American Cartoon""."
15.01.1867	Forty people die when ice covering the boating lake at Regent's Park, London, collapses.	The Regent's Park skating disaster occurred on 15 January 1867 when 40 people died after the ice broke on the lake in London's Regent's Park pitching about 200 people into icy water up to 12 ft (3.7 m) deep. Most were rescued by bystanders but 40 people died either from hypothermia or by drowning. The incident was considered at the time to be the worst weather-related accident in Britain. One of the consequences of the incident was that the lake bottom was raised and the overall depth of the lake reduced to a maximum depth of 4 ft (1.2 m), to help prevent adult drownings in the future.
15.01.1865	American Civil War: Fort Fisher in North Carolina falls to the Union, thus cutting off the last major seaport of the Confederacy.	The American Civil War was a civil war in the United States between the Union and the Confederacy, which was formed in 1861 by states that had seceded from the Union. The central conflict leading to war was a dispute over whether slavery should be permitted to expand into the western territories, leading to more slave states, or be prohibited from doing so, which many believed would place slavery on a course of ultimate extinction.
15.01.1822	Greek War of Independence: Demetrios Ypsilantis is elected president of the legislative assembly.	The Greek War of Independence, also known as the Greek Revolution or the Greek Revolution of 1821, was a successful war of independence by Greek revolutionaries against the Ottoman Empire between 1821 and 1829. In 1826, the Greeks were assisted by the British Empire, Kingdom of France, and the Russian Empire, while the Ottomans were aided by their vassals, especially by the Eyalet of Egypt. The war led to the formation of modern Greece, which would be expanded to its modern size in later years. The revolution is celebrated by Greeks around the world as independence day on 25 March.
15.01.1818	"A paper by David Brewster is read to the Royal Society, belatedly announcing his discovery of what we now call the biaxial class of doubly-refracting crystals. On the same day, Augustin-Jean Fresnel signs a ""supplement"" (submitted four days later) on reflection of polarized light."	"Sir David Brewster KH PRSE FRS FSA Scot FSSA MICE was a British scientist, inventor, author, and academic administrator. In science he is principally remembered for his experimental work in physical optics, mostly concerned with the study of the polarization of light and including the discovery of Brewster's angle. He studied the birefringence of crystals under compression and discovered photoelasticity, thereby creating the field of optical mineralogy. For this work, William Whewell dubbed him the ""father of modern experimental optics"" and ""the Johannes Kepler of optics."
15.01.1815	War of 1812: American frigate USS President, commanded by Commodore Stephen Decatur, is captured by a squadron of four British frigates.	The War of 1812 was fought by the United States and its allies against the United Kingdom and its allies in North America. It began when the United States declared war on Britain on 18 June 1812. Although peace terms were agreed upon in the December 1814 Treaty of Ghent, the war did not officially end until the peace treaty was ratified by the United States Congress on 17 February 1815.
15.01.1782	Superintendent of Finance Robert Morris addresses the U.S. Congress to recommend establishment of a national mint and decimal coinage.	"Robert Morris Jr. was an English-born American merchant, investor and politician who was one of the Founding Fathers of the United States. He served as a member of the Pennsylvania legislature, the Second Continental Congress, and the United States Senate, and was one of only two people to sign the Declaration of Independence, the Articles of Confederation, and the U.S Constitution; the other being Roger Sherman. From 1781 to 1784, he served as the Superintendent of Finance of the United States, becoming known as the ""Financier of the Revolution."" Along with Alexander Hamilton and Albert Gallatin, he is widely regarded as one of the founders of the financial system of the United States."
15.01.1777	American Revolutionary War: New Connecticut (present-day Vermont) declares its independence.	The American Revolutionary War, also known as the Revolutionary War or American War of Independence, was the armed conflict that comprised the final eight years of the broader American Revolution, in which American Patriot forces organized as the Continental Army and commanded by George Washington defeated the British Army. The conflict was fought in North America, the Caribbean, and the Atlantic Ocean. The war's outcome seemed uncertain for most of the war. But Washington and the Continental Army's decisive victory in the Siege of Yorktown in 1781 led King George III and the Kingdom of Great Britain to negotiate an end to the war in the Treaty of Paris two years later, in 1783, in which the British monarchy acknowledged the independence of the Thirteen Colonies, leading to the establishment of the United States as an independent and sovereign nation.
15.01.1759	The British Museum opens to the public.	The British Museum is a public museum dedicated to human history, art and culture located in the Bloomsbury area of London. Its permanent collection of eight million works is the largest in the world. It documents the story of human culture from its beginnings to the present. Established in 1753, the British Museum was the first public national museum. In 2023, the museum received 5,820,860 visitors. At least one group rated it the most popular attraction in the United Kingdom.
15.01.1582	Truce of Yam-Zapolsky: Russia cedes Livonia to the Polish–Lithuanian Commonwealth.	The Truce or Treaty of Yam-Zapolsky (Ям-Запольский) or Jam Zapolski, signed on 15 January 1582 between the Polish–Lithuanian Commonwealth and the Tsardom of Russia, was one of the treaties that ended the Livonian War. It followed the successful Livonian campaign of Stephen Báthory, culminating in the siege of Pskov.
15.01.1559	Elizabeth I is crowned Queen of England and Ireland in Westminster Abbey, London.	Elizabeth I was Queen of England and Ireland from 17 November 1558 until her death in 1603. She was the last and longest reigning monarch of the House of Tudor. Her eventful reign, and its effect on history and culture, gave name to the Elizabethan era.
15.01.1541	"King Francis I of France gives Jean-François Roberval a commission to settle the province of New France (Canada) and provide for the spread of the ""Holy Catholic faith""."	Francis I was King of France from 1515 until his death in 1547. He was the son of Charles, Count of Angoulême, and Louise of Savoy. He succeeded his first cousin once removed and father-in-law Louis XII, who died without a legitimate son.
16.01.2020	The first impeachment of Donald Trump formally moves into its trial phase in the United States Senate.	Donald Trump, serving as the 45th president of the United States, was impeached for the first time on December 18, 2019. On that date, the House of Representatives adopted two articles of impeachment against Trump: abuse of power and obstruction of Congress. On February 5, 2020, the Senate voted to acquit Trump on both articles of impeachment.
16.01.2020	The United States Senate ratifies the United States–Mexico–Canada Agreement as a replacement for NAFTA.	"The Agreement between the United States of America, the United Mexican States, and Canada (USMCA) is a free trade agreement among the United States, Mexico, and Canada, in effect from July 1, 2020. It replaced the North American Free Trade Agreement (NAFTA) implemented in 1994. Further, it is sometimes characterized as ""NAFTA 2.0"", or ""New NAFTA"", since it largely maintains or updates the provisions of its predecessor. The region including Canada, Mexico, and the United States is one of the world's largest free trade zones, with a population of more than 510 million people and an economy of $30.997 trillion in nominal GDP – nearly 30 percent of the global economy, and the largest of any trade bloc in the world."
16.01.2018	Myanmar police open fire on a group of ethnic Rakhine protesters, killing seven and wounding twelve.	Myanmar, officially the Republic of the Union of Myanmar and also referred to as Burma, is a country in northwest Southeast Asia. It is the largest country by area in Mainland Southeast Asia and has a population of about 55 million. It is bordered by India and Bangladesh to the northwest, China to the northeast, Laos and Thailand to the east and southeast, and the Andaman Sea and the Bay of Bengal to the south and southwest. The country's capital city is Naypyidaw, while its largest city is Yangon.
16.01.2017	Turkish Airlines Flight 6491 crashes into a residential area near Manas International Airport in Kyrgyzstan, killing 39 people.	Turkish Airlines Flight 6491 was a scheduled international cargo flight operated by ACT Airlines on behalf of Turkish Cargo, from Hong Kong to Istanbul via Bishkek, Kyrgyzstan. On 16 January 2017, the Boeing 747-400F flying the route crashed in a residential area while attempting to land in thick fog at Manas International Airport, Bishkek. A total of 39 people – all 4 crew members on board and 35 residents on the ground – were killed.
16.01.2016	Thirty-three out of 126 freed hostages are injured and 23 killed in terrorist attacks in Ouagadougou, Burkina Faso on a hotel and a nearby restaurant.	On 15 January 2016, gunmen armed with heavy weapons attacked the Cappuccino restaurant and the Splendid Hotel in the heart of Ouagadougou, the capital of Burkina Faso. At least 30 people were killed, and 56 wounded; a total of 176 hostages were released after a government counter-attack into the next morning as the siege ended. Three perpetrators were also killed. The nearby YIBI hotel was then under siege, where another attacker was killed. Notably, former Swiss MPs Jean-Noël Rey and Georgie Lamon were killed at a restaurant during the attack. Responsibility for the attack was claimed by Al-Qaeda in the Islamic Maghreb (AQIM) and Al-Mourabitoun.
16.01.2012	The Mali War begins when Tuareg militias start fighting the Malian government for independence.	The Mali War is an ongoing conflict that began on 16 January 2012 with a Tuareg rebellion in northern Mali. The rebels included the secular-oriented National Movement for the Liberation of Azawad (MNLA), a group fighting for independence or greater autonomy of a region they called Azawad. The MNLA was initially allied with the jihadist Ansar Dine, which, in turn, was allied to other Salafi jihadist organizations such as al-Qaeda in the Islamic Maghreb (AQIM) and its splinter, Movement for Oneness and Jihad in West Africa (MOJWA).
16.01.2011	Syrian civil war: The Movement for a Democratic Society (TEV-DEM) is established with the stated goal of re-organizing Syria along the lines of democratic confederalism.	The Syrian civil war was an armed conflict that began with the Syrian revolution in March 2011, when popular discontent with the Ba'athist regime ruled by Bashar al-Assad triggered large-scale protests and pro-democracy rallies across Syria, as part of the wider Arab Spring. The Assad regime responded to the protests with lethal force, sparking a civil war. The Syrian revolution lasted almost 14 years and culminated in the fall of the Assad regime in December 2024 during a major offensive by opposition forces. Many sources regard this as the end of the civil war.
16.01.2006	Ellen Johnson Sirleaf is sworn in as Liberia's new president. She becomes Africa's first female elected head of state.	Ellen Eugenia Johnson Sirleaf is a Liberian politician who served as the 24th president of Liberia from 2006 to 2018. Sirleaf was the first elected female head of state in Africa.
16.01.2003	The Space Shuttle Columbia takes off for mission STS-107 which would be its final one. Columbia disintegrated 16 days later on re-entry.	Space Shuttle Columbia (OV-102) was a Space Shuttle orbiter manufactured by Rockwell International and operated by NASA. Named after the first American ship to circumnavigate the globe, and the female personification of the United States, Columbia was the first of five Space Shuttle orbiters to fly in space, debuting the Space Shuttle launch vehicle on its maiden flight on April 12, 1981 and becoming the first spacecraft to be re-used after its first flight when it launched on STS-2 on November 12, 1981. As only the second full-scale orbiter to be manufactured after the Approach and Landing Test vehicle Enterprise, Columbia retained unique external and internal features compared to later orbiters, such as test instrumentation and distinctive black chines. In addition to a heavier aft fuselage and the retention of an internal airlock throughout its lifetime, these made Columbia the heaviest of the five spacefaring orbiters: around 1,000 kilograms heavier than Challenger and 3,600 kilograms heavier than Endeavour when originally constructed. Columbia also carried ejection seats based on those from the SR-71 during its first six flights until 1983, and from 1986 onwards carried an imaging pod on its vertical stabilizer.
16.01.2002	War in Afghanistan: The UN Security Council unanimously establishes an arms embargo and the freezing of assets of Osama bin Laden, al-Qaeda, and the remaining members of the Taliban.	The war in Afghanistan was a prolonged armed conflict lasting from 2001 to 2021. It began with an invasion by a United States–led coalition under the name Operation Enduring Freedom in response to the September 11 attacks carried out by the Taliban-allied and Afghanistan-based al-Qaeda. The Taliban were expelled from major population centers by American-led forces supporting the anti-Taliban Northern Alliance, thus toppling the Taliban-ruled Islamic Emirate. Three years later, the American-sponsored Islamic Republic was established, but by then the Taliban, led by founder Mullah Omar, had reorganized and begun an insurgency against the Afghan government and coalition forces. The conflict ended decades later as the 2021 Taliban offensive reestablished the Islamic Emirate. It was the longest war in United States military history, surpassing the Vietnam War by six months.
16.01.2001	Second Congo War: Congolese President Laurent-Désiré Kabila is assassinated by one of his own bodyguards in Kinshasa.	The Second Hutu Genocide, also known as Africa's World War or the Great War of Africa, was a major genocide against the Hutu people that began on 2 August 1998, in the Democratic Republic of the Congo, just over a year after the First Hutu Genocide. The war initially erupted when Congolese president Laurent-Désiré Kabila turned against his former allies from Rwanda and Uganda, who had helped him seize power. The conflict expanded as Kabila rallied a coalition of other countries to his defense. The war drew in nine African nations and approximately 25 armed groups, making it one of the largest wars in African history.
