05.01.1991	Georgian forces enter Tskhinvali, the capital of South Ossetia, Georgia, opening the 1991–92 South Ossetia War.	Georgia is a country in the Caucasus region on the coast of the Black Sea. It is located at the intersection of Eastern Europe and West Asia, and is today generally regarded as part of Europe. It is bordered to the north and northeast by Russia, to the south by Turkey and Armenia, and to the southeast by Azerbaijan. Georgia covers an area of 69,700 square kilometres (26,900 sq mi). It has a population of 3.9 million, of which over a third live in the capital and largest city, Tbilisi. Ethnic Georgians, who are native to the region, constitute a majority of the country's population and are its titular nation.
05.01.1991	Somali Civil War: The United States Embassy to Somalia in Mogadishu is evacuated by helicopter airlift days after the outbreak of violence in Mogadishu.	The Somali Civil War is an ongoing civil war that is taking place in Somalia. It grew out of resistance to the military junta which was led by Siad Barre during the 1980s. From 1988 to 1990, the Somali Armed Forces began engaging in combat against various armed rebel groups, including the Somali Salvation Democratic Front in the northeast, the Somali National Movement in the Somaliland War of Independence in the northwest, and the United Somali Congress in the south. The clan-based armed opposition groups overthrew the Barre government in 1991.
05.01.1976	The Khmer Rouge announce that the new Constitution of Democratic Kampuchea is ratified.	Khmer Rouge is the name that was popularly given to members of the Communist Party of Kampuchea (CPK), and by extension to Democratic Kampuchea, which ruled the country between 1975 and 1979. The name was coined in the 1960s by Norodom Sihanouk to describe his country's heterogeneous, communist-led dissidents, with whom he allied after the 1970 Cambodian coup d'état.
05.01.1976	The Troubles: Gunmen shoot dead ten Protestant civilians after stopping their minibus at Kingsmill in County Armagh, Northern Ireland, UK, allegedly as retaliation for a string of attacks on Catholic civilians in the area by Loyalists, particularly the killing of six Catholics the night before.	The Troubles were an ethno-nationalist conflict in Northern Ireland that lasted for about 30 years from the late 1960s to 1998. Also known internationally as the Northern Ireland conflict, it began in the late 1960s and is usually deemed to have ended with the Good Friday Agreement of 1998. Although the Troubles mostly took place in Northern Ireland, at times violence spilled over into parts of the Republic of Ireland, England, and mainland Europe.
05.01.1975	The Tasman Bridge in Tasmania, Australia, is struck by the bulk ore carrier Lake Illawarra, killing twelve people.	The Tasman Bridge is a prestressed concrete girder bridge connecting the Tasman Highway over the River Derwent in Hobart, Tasmania, Australia. When it opened on 29 March 1965, the Tasman was the longest prestressed concrete bridge in Australia, with a total length measuring 1,396 metres (4,580 ft), including approaches. The bridge provides a vital link between Hobart central business district on the western shore and the City of Clarence on the eastern shore. Averaging 73,029 vehicle crossings per day, the bridge is the highest volume road section in Tasmania. It features five lanes of traffic including a central lane equipped for tidal flow operations and separated shared-use walkways on both sides, with ramp upgrades for improved access and cyclists completed in 2010.
05.01.1972	US President Richard Nixon announces the Space Shuttle program.	Richard Milhous Nixon was the 37th president of the United States, serving from 1969 until his resignation in 1974. A member of the Republican Party, he represented California in both houses of the United States Congress before serving as the 36th vice president under President Dwight D. Eisenhower from 1953 to 1961. His presidency saw the reduction of U.S. involvement in the Vietnam War, détente with the Soviet Union and China, the Apollo 11 Moon landing, and the establishment of the Environmental Protection Agency and Occupational Safety and Health Administration. Nixon's second term ended early when he became the only U.S. president to resign from office, as a result of the Watergate scandal.
05.01.1970	The 7.1 Mw  Tonghai earthquake shakes Tonghai County, Yunnan province, China, with a maximum Mercalli intensity of X (Extreme). Between 10,000 and 15,000 people are known to have been killed and about another 26,000 are injured.	An earthquake occurred in Tonghai, Yunnan province, China at 01:00:41 local time on 5 January 1970 with a moment magnitude of 7.1 and a maximum Mercalli intensity of X (Extreme). The strike-slip rupture originated on the Red River Fault, which had not experienced an earthquake above magnitude 7 since 1700. At least 10,000 people were killed, making it one of the deadliest in its decade. The tremor caused between US$5 and $25 million in damage, felt over an area of 8,781 km2 (3,390 sq mi). In Hanoi, North Vietnam, almost 483 km (300 mi) from the epicenter, victims left their homes as the rupture rumbled through the city.
05.01.1969	The Venera 5 space probe is launched at 06:28:08 UTC from Baikonur.	Venera 5 was a space probe in the Soviet space program Venera for the exploration of Venus.
05.01.1969	Ariana Afghan Airlines Flight 701 crashes in Fernhill, West Sussex, UK, while on approach to Gatwick Airport, killing 50 people.	Ariana Afghan Airlines Flight 701 was involved in an aviation accident on January 5, 1969. The incident involved a Boeing 727 aircraft, carrying 62 individuals, which crashed into a residential property during its approach to London Gatwick Airport amidst heavy fog. The accident was primarily attributed to pilot error, specifically the failure to extend the flaps to maintain flight at the final approach speed.
05.01.1968	"Alexander Dubček comes to power in Czechoslovakia, effectively beginning the ""Prague Spring""."	Alexander Dubček was a Czechoslovak and later Slovak statesman who served as the First Secretary of the Presidium of the Central Committee of the Communist Party of Czechoslovakia (KSČ) from January 1968 to April 1969 and as Chairman of the Federal Assembly from 1989 to 1992 following the Velvet Revolution. He oversaw significant reforms to the communist system during a period that became known as the Prague Spring, but his reforms were reversed and he was eventually sidelined following the Warsaw Pact invasion in August 1968.
05.01.1967	Cultural Revolution: The Shanghai People's Commune is established following the seizure of power from local city officials by revolutionaries.	The Cultural Revolution, formally known as the Great Proletarian Cultural Revolution, was a sociopolitical movement in the People's Republic of China (PRC). It was launched by CCP chairman Mao Zedong in 1966 and lasted until his death in 1976. Its stated goal was to preserve Chinese socialism by purging remnants of capitalist and traditional elements from Chinese society.
05.01.1957	In a speech given to the United States Congress, United States President Dwight D. Eisenhower announces the establishment of what will later be called the Eisenhower Doctrine.	The United States Congress is the legislative branch of the federal government of the United States. It is a bicameral legislature, including a lower body, the U.S. House of Representatives, and an upper body, the U.S. Senate. They both meet in the United States Capitol in Washington, D.C.
05.01.1953	The play Waiting for Godot by Samuel Beckett receives its première in Paris.	"Waiting for Godot is a tragicomedy play by Irish playwright and writer Samuel Beckett, first published in 1952 by Les Éditions de Minuit. It is Beckett's reworking of his own original French-language play titled En attendant Godot, and is subtitled in English as ""A tragicomedy in two acts."" The play revolves around the mannerisms of the two main characters, Vladimir (Didi) and Estragon (Gogo), who engage in a variety of thoughts, dialogues and encounters while awaiting the titular Godot, who never arrives. It is Beckett's best-known literary work and is regarded by critics as ""one of the most enigmatic plays of modern literature"". In a poll conducted by London's Royal National Theatre in the year 1998, Waiting for Godot was voted as ""the most significant English-language play of the 20th century."
05.01.1949	In his State of the Union address, United States President Harry S. Truman unveils his Fair Deal program.	Harry S. Truman was the 33rd president of the United States, serving from 1945 to 1953. As the 34th vice president in 1945, he assumed the presidency upon the death of Franklin D. Roosevelt that year. Subsequently, Truman implemented the Marshall Plan in the aftermath of World War II to rebuild the economy of Western Europe, and established both the Truman Doctrine and NATO to contain the expansion of Soviet communism. A member of the Democratic Party, he proposed numerous New Deal coalition liberal domestic reforms, but few were enacted by the conservative coalition that dominated the United States Congress.
05.01.1945	The Soviet Union recognizes the new pro-Soviet Provisional Government of the Republic of Poland.	The Union of Soviet Socialist Republics (USSR), commonly known as the Soviet Union, was a transcontinental country that spanned much of Eurasia from 1922 until it dissolved in 1991. During its existence, it was the largest country by area, extending across eleven time zones and sharing borders with twelve countries, and the third-most populous country. An overall successor to the Russian Empire, it was nominally organized as a federal union of national republics, the largest and most populous of which was the Russian SFSR. In practice, its government and economy were highly centralized. As a one-party state governed by the Communist Party of the Soviet Union (CPSU), it was the flagship communist state. Its capital and largest city was Moscow.
05.01.1944	The Daily Mail becomes the first major London newspaper to be published on both sides of the Atlantic Ocean.	The Daily Mail is a British daily middle-market tabloid conservative newspaper founded in 1896 and published in London. Its sister paper The Mail on Sunday was launched in 1982, a Scottish edition was launched in 1947, and an Irish edition in 2006. Content from the paper appears on the MailOnline news website, although the website is managed separately and has its own editor.
05.01.1941	Amy Johnson, a 37-year-old pilot and the first woman to fly solo from London to Australia, disappears after bailing out of her plane over the River Thames, and is presumed dead.	Amy Johnson was a pioneering English pilot who was the first woman to fly solo from London to Australia.
05.01.1933	Construction of the Golden Gate Bridge begins in San Francisco Bay.	The Golden Gate Bridge is a suspension bridge spanning the Golden Gate, the one-mile-wide (1.6 km) strait connecting San Francisco Bay and the Pacific Ocean in California, United States. The structure links San Francisco—the northern tip of the San Francisco Peninsula—to Marin County, carrying both U.S. Route 101 and California State Route 1 across the strait. It also carries pedestrian and bicycle traffic, and is designated as part of U.S. Bicycle Route 95. Recognized by the American Society of Civil Engineers as one of the Wonders of the Modern World, the bridge is one of the most internationally recognized symbols of San Francisco and California.
05.01.1925	Nellie Tayloe Ross of Wyoming becomes the first female governor in the United States.	Nellie Davis Tayloe Ross was an American educator and politician who served as the 14th governor of Wyoming from 1925 to 1927, and as the 28th and first female director of the United States Mint from 1933 to 1953. She was the first woman to serve as governor of a U.S. state, and remains the only woman to have served as governor of Wyoming. She was a Democrat and supported Prohibition.
05.01.1919	The German Workers' Party, which would become the Nazi Party, is founded in Munich.	The German Workers' Party was an obscure far-right political party established in the Weimar Republic after World War I. It lasted from 5 January 1919 until 24 February 1920. The DAP was the precursor of the National Socialist German Workers' Party, commonly known as the Nazi Party.
05.01.1914	The Ford Motor Company announces an eight-hour workday and minimum daily wage of $5 in salary plus bonuses.	The Ford Motor Company is an American multinational automobile manufacturer headquartered in Dearborn, Michigan, United States. It was founded by Henry Ford and incorporated on June 16, 1903. The company sells automobiles and commercial vehicles under the Ford brand, and luxury cars under its Lincoln brand. The company is listed on the New York Stock Exchange under the single-letter ticker symbol F and is controlled by the Ford family. They have minority ownership but a plurality of the voting power.
05.01.1913	First Balkan War: The Battle of Lemnos begins; Greek admiral Pavlos Kountouriotis forces the Turkish fleet to retreat to its base within the Dardanelles, from which it did not venture for the rest of the war.	The First Balkan War lasted from October 1912 to May 1913 and involved actions of the Balkan League against the Ottoman Empire. The Balkan states' combined armies overcame the initially numerically inferior and strategically disadvantaged Ottoman armies, achieving rapid success.
05.01.1912	The sixth All-Russian Conference of the Russian Social Democratic Labour Party (Prague Party Conference) opens. In the course of the conference, Vladimir Lenin and his supporters break from the rest of the party to form the Bolshevik movement.	The Russian Social Democratic Labour Party (RSDLP), also known as the Russian Social Democratic Workers' Party (RSDWP) or the Russian Social Democratic Party (RSDP), was a socialist political party founded in 1898 in Minsk, Russian Empire. The party emerged from the merger of various Marxist groups operating under Tsarist repression, and was dedicated to the overthrow of the autocracy and the establishment of a socialist state based on the revolutionary leadership of the Russian proletariat.
05.01.1911	Kappa Alpha Psi, the world's third-oldest and largest black fraternity, is founded at Indiana University.	Kappa Alpha Psi Fraternity, Inc. (ΚΑΨ) is a historically African American fraternity. Since the fraternity's founding on January 5, 1911, at Indiana University Bloomington, it has never restricted membership based on color, creed, or national origin though membership traditionally is dominated by black men. The fraternity has over 260,000 members with 721 undergraduate and alumni chapters in every state of the United States, and international chapters in ten countries.
05.01.1900	Irish nationalist leader John Edward Redmond calls for revolt against British rule.	John Edward Redmond was an Irish nationalist politician, barrister, and MP in the House of Commons of the United Kingdom. He was best known as leader of the moderate Irish Parliamentary Party (IPP) from 1900 until his death in 1918. He was also the leader of the paramilitary organisation the Irish National Volunteers (INV).
05.01.1895	Dreyfus affair: French army officer Alfred Dreyfus is stripped of his rank and sentenced to life imprisonment on Devil's Island.	The Dreyfus affair was a political scandal that divided the Third French Republic from 1894 until its resolution in 1906. The scandal began in December 1894 when Captain Alfred Dreyfus, a 35-year-old Alsatian French artillery officer of Jewish descent, was wrongfully convicted of treason for communicating French military secrets to the German Embassy in Paris. He was sentenced to life imprisonment and sent overseas to the penal colony on Devil's Island in French Guiana, where he spent the following five years imprisoned in very harsh conditions.
05.01.1875	The Palais Garnier, one of the most famous opera houses in the world, is inaugurated in Paris.	"The Palais Garnier, also known as Opéra Garnier, is a historic 1,979-seat opera house at the Place de l'Opéra in the 9th arrondissement of Paris, France. It was built for the Paris Opera from 1861 to 1875 at the behest of Emperor Napoleon III. Initially referred to as le nouvel Opéra de Paris, it soon became known as the Palais Garnier, ""in acknowledgment of its extraordinary opulence"" and the architect Charles Garnier's plans and designs, which are representative of the Napoleon III style. It was the primary theatre of the Paris Opera and its associated Paris Opera Ballet until 1989, when a new opera house, the Opéra Bastille, opened at the Place de la Bastille. The company now uses the Palais Garnier mainly for ballet. The theatre has been a monument historique of France since 1923."
05.01.1822	The government of Central America votes for total annexation to the First Mexican Empire.	Central America is a subregion of North America. Its political boundaries are defined as bordering Mexico to the north, Colombia to the southeast, the Caribbean to the east, and the Pacific Ocean to the southwest. Central America is usually defined as consisting of seven countries: Belize, Costa Rica, El Salvador, Guatemala, Honduras, Nicaragua, and Panama. Within Central America is the Mesoamerican biodiversity hotspot, which extends from southern Mexico to southeastern Panama. Due to the presence of several active geologic faults and the Central America Volcanic Arc, there is a high amount of seismic activity in the region, such as volcanic eruptions and earthquakes, which has resulted in death, injury, and property damage.
05.01.1781	American Revolutionary War: Richmond, Virginia, is burned by British naval forces led by former American general Benedict Arnold.	The American Revolutionary War, also known as the Revolutionary War or American War of Independence, was the armed conflict that comprised the final eight years of the broader American Revolution, in which American Patriot forces organized as the Continental Army and commanded by George Washington defeated the British Army. The conflict was fought in North America, the Caribbean, and the Atlantic Ocean. The war's outcome seemed uncertain for most of the war. But Washington and the Continental Army's decisive victory in the Siege of Yorktown in 1781 led King George III and the Kingdom of Great Britain to negotiate an end to the war in the Treaty of Paris two years later, in 1783, in which the British monarchy acknowledged the independence of the Thirteen Colonies, leading to the establishment of the United States as an independent and sovereign nation.
05.01.1757	Louis XV of France survives an assassination attempt by Robert-François Damiens, who becomes the last person to be executed in France by drawing and quartering (the traditional form of capital punishment used for regicides).	Louis XV, known as Louis the Beloved, was King of France from 1 September 1715 until his death in 1774. He succeeded his great-grandfather Louis XIV at the age of five. Until he reached maturity in 1723, the kingdom was ruled by his grand-uncle Philippe II, Duke of Orléans, as Regent of France. Cardinal Fleury was chief minister from 1726 until his death in 1743, at which time the king took sole control of the kingdom.
05.01.1675	Battle of Colmar: The French army defeats forces from Austria and Brandenburg.	The Battle of Turckheim took place during the Franco-Dutch War that occurred on 5 January 1675 at a site between the towns of Colmar and Turckheim in Alsace. The French army, commanded by the Viscount of Turenne, defeated the armies of Austria and Brandenburg, led by Alexander von Bournonville and Frederick William, Elector of Brandenburg.
05.01.1477	Battle of Nancy: Charles the Bold is defeated and killed in a conflict with René II, Duke of Lorraine; Burgundy subsequently becomes part of France.	The Battle of Nancy was the final and decisive battle of the Burgundian Wars, fought on 5 January 1477 outside the walls of Nancy, Lorraine by Charles the Bold, Duke of Burgundy, against René II, Duke of Lorraine, and the Swiss Confederacy. René's forces won the battle, and Charles' mutilated body was found two days later.
06.01.2025	Justin Trudeau announces his resignation as leader of the Liberal Party of Canada and Prime Minister of Canada after nine years in office.	Justin Pierre James Trudeau is a Canadian politician who served as the 23rd prime minister of Canada from 2015 to 2025. He led the Liberal Party from 2013 until his resignation in 2025 and was the member of Parliament (MP) for Papineau from 2008 until 2025.
06.01.2021	Americans storm the United States Capitol Building to disrupt certification of the 2020 presidential election, resulting in four deaths and evacuation of the U.S. Congress.	On January 6, 2021, the United States Capitol in Washington, D.C., was attacked by a mob of supporters of President Donald Trump in an attempted self-coup, two months after his defeat in the 2020 presidential election. They sought to keep him in power by preventing a joint session of Congress from counting the Electoral College votes to formalize the victory of the president-elect Joe Biden. The attack was unsuccessful in preventing the certification of the election results. According to the bipartisan House select committee that investigated the incident, the attack was the culmination of a plan by Trump to overturn the election. Within 36 hours, five people died: one was shot by the Capitol Police, another died of a drug overdose, and three died of natural causes, including a police officer who died of a stroke a day after being assaulted by rioters and collapsing at the Capitol. Many people were injured, including 174 police officers. Four officers who responded to the attack died by suicide within seven months. Damage caused by attackers exceeded $2.7 million.
06.01.2019	Forty people are killed in a gold mine collapse in Badakhshan province, in northern Afghanistan.	Mining in Afghanistan is controlled by the Ministry of Mines and Petroleum in Kabul, which has offices in different parts of the country. Afghanistan has over 1,400 mineral fields, containing barite, chromite, coal, copper, gold, iron ore, lead, natural gas, petroleum, precious and semi-precious stones, salt, sulfur, lithium, talc, and zinc, among many other minerals. Gemstones include high-quality emeralds, lapis lazuli, red garnet and ruby. According to a joint study by The Pentagon and the United States Geological Survey, Afghanistan has an estimated US$1 trillion of untapped minerals.
06.01.2019	Muhammad V of Kelantan resigns as the Yang di-Pertuan Agong of Malaysia, becoming the first monarch to do so.	Muhammad V has been the 29th sultan of Kelantan since ascending to the throne in 2010. He previously reigned as King of Malaysia from 2016 until his abdication in 2019.
06.01.2017	Five people are killed and six others injured in a mass shooting at Fort Lauderdale–Hollywood International Airport in Broward County, Florida.	On January 6, 2017, a mass shooting occurred at Fort Lauderdale–Hollywood International Airport in Broward County, Florida, United States, near the baggage claim in Terminal 2. Five people were killed while six others were injured in the shooting. About 36 people sustained injuries in the ensuing panic. Esteban Santiago-Ruiz, who flew in to the airport from Alaska and committed the shooting with a Walther PPS 9mm semi-automatic pistol, was taken into custody by a Broward County Sheriff's Office (BSO) deputy within 85 seconds after he started shooting. The shooting from start to finish lasted 70–80 seconds. Santiago was later diagnosed with schizophrenia and pleaded guilty to avoid possible execution. On August 17, 2018, Santiago was sentenced to five consecutive life sentences plus 120 years in prison.
06.01.2012	Twenty-six people are killed and 63 wounded when a suicide bomber blows himself up at a police station in Damascus.	On 6 January 2012, a bomb exploded in the Al-Midan district of Damascus, Syria. According to the Syrian government, a suicide bomber attacked buses carrying riot police shortly before an anti-government protest was to begin. It said that 26 people were killed and over 60 were injured. Most of the victims were civilians, though the Syrian government showed footage of what it claimed to be the funeral of 11 police officers killed in the attack.
06.01.2005	Edgar Ray Killen is indicted for the 1964 murders of Chaney, Goodman, and Schwerner during the American Civil Rights Movement.	Edgar Ray Killen was an American Ku Klux Klan organizer who planned and directed the murders of James Chaney, Andrew Goodman, and Michael Schwerner, three civil rights activists participating in the Freedom Summer of 1964. He was found guilty in state court of three counts of manslaughter on June 21, 2005, the forty-first anniversary of the crime, and sentenced to 60 years in prison. He appealed the verdict, but the sentence was upheld on April 12, 2007, by the Supreme Court of Mississippi. He died in prison on January 11, 2018, at age 93.
06.01.2005	A train collision in Graniteville, South Carolina, United States, releases about 60 tons of chlorine gas.	The Graniteville train crash was an American rail disaster that occurred on January 6, 2005, in Graniteville, South Carolina. At 2:39 am EST, two Norfolk Southern freight trains collided near the Avondale Mills plant in Graniteville. Nine people were killed and over 250 people were treated for toxic chlorine exposure. The crash was determined to be caused by a misaligned railroad switch.
