10.01.1920	League of Nations Covenant automatically enters into force after the Treaty of Versailles is ratified by Germany.	The Covenant of the League of Nations  was the charter of the League of Nations. It was signed on 28 June 1919 as Part I of the Treaty of Versailles, and became effective together with the rest of the Treaty on 10 January 1920.
10.01.1917	Imperial Trans-Antarctic Expedition: Seven survivors of the Ross Sea party were rescued after being stranded for several months.	"The Imperial Trans-Antarctic Expedition of 1914–1917 is considered to be the last major expedition of the Heroic Age of Antarctic Exploration. Conceived by Sir Ernest Shackleton, the expedition was an attempt to make the first land crossing of the Antarctic continent. After Roald Amundsen's South Pole expedition in 1911, this crossing remained, in Shackleton's words, the ""one great main object of Antarctic journeyings"". Shackleton's expedition failed to accomplish this objective but became recognised instead as an epic feat of endurance."
10.01.1916	World War I: Imperial Russia begins the Erzurum Offensive, leading to the defeat of the Ottoman Empire's Third Army.	World War I or the First World War, also known as the Great War, was a global conflict between two coalitions: the Allies and the Central Powers. Main areas of conflict included Europe and the Middle East, as well as parts of Africa and the Asia-Pacific. There were important developments in weaponry including tanks, aircraft, artillery, machine guns, and chemical weapons. One of the deadliest conflicts in history, it resulted in an estimated 30 million military casualties, plus another 8 million civilian deaths from war-related causes and genocide. The movement of large numbers of people was a major factor in the deadly Spanish flu pandemic.
10.01.1901	The first great Texas oil gusher is discovered at Spindletop in Beaumont, Texas.	Texas is the most populous state in the South Central region of the United States. It borders Louisiana to the east, Arkansas to the northeast, Oklahoma to the north, New Mexico to the west, and an international border with the Mexican states of Chihuahua, Coahuila, Nuevo León, and Tamaulipas to the south and southwest. Texas has a coastline on the Gulf of Mexico to the southeast. Covering 268,596 square miles (695,660 km2) and with over 31 million residents as of 2024, it is the second-largest state in the United States by area and population. Texas is nicknamed the Lone Star State for the single star on its flag, symbolic of its former status as an independent country, the Republic of Texas.
10.01.1901	New York: Automobile Club of America installs signs on major highways.	The Automobile Club of America (ACA) was the first automobile club formed in America in 1899. The club was dissolved in 1932 following the Great Depression and declining membership.
10.01.1876	The Plan of Tuxtepec is announced.	In Mexican history, the Plan of Tuxtepec was a plan drafted by General Porfirio Díaz in 1876 and proclaimed on 10 January 1876 in the Villa de Ojitlán municipality of San Lucas Ojitlán, Tuxtepec district, Oaxaca. It was signed by a group of military officers led by Colonel Hermenegildo Sarmiento and drafted by porfiristas Vicente Riva Palacio, Ireneo Paz, and Protasio Tagle on the instigation of Díaz. Díaz signed the previous version of the plan in December 1875, which did not include the three most important articles that appointed Diaz as president. It disavowed Sebastián Lerdo de Tejada as President, while acknowledging the Constitution and the Reform laws, and proclaimed Díaz as the leader of the movement. Díaz later became the president of Mexico, ushering in a period known as the Porfiriato.
10.01.1870	John D. Rockefeller incorporates Standard Oil.	John Davison Rockefeller Sr. was an American businessman and philanthropist. He was one of the wealthiest Americans of all time and one of the richest people in modern history. Rockefeller was born into a large family in Upstate New York who moved several times before eventually settling in Cleveland, Ohio. He became an assistant bookkeeper at age 16 and went into several business partnerships beginning at age 20, concentrating his business on oil refining. Rockefeller founded the Standard Oil Company in 1870. He ran it until 1897 and remained its largest shareholder. In his retirement, he focused his energy and wealth on philanthropy, especially regarding education, medicine, higher education, and modernizing the Southern United States.
10.01.1863	The Metropolitan Railway, the world's oldest underground railway, opens between Paddington and Farringdon, marking the beginning of the London Underground.	The Metropolitan Railway was a passenger and goods railway that served London from 1863 to 1933, its main line heading north-west from the capital's financial heart in the City to what were to become the Middlesex suburbs. Its first line connected the main-line railway termini at Paddington, Euston, and King's Cross to the City. The first section was built beneath the New Road using cut-and-cover between Paddington and King's Cross and in tunnel and cuttings beside Farringdon Road from King's Cross to near Smithfield, near the City. It opened to the public on 10 January 1863 with gas-lit wooden carriages hauled by steam locomotives, the world's first passenger-carrying designated underground railway.
10.01.1861	American Civil War: Florida becomes the third state to secede from the Union.	The American Civil War was a civil war in the United States between the Union and the Confederacy, which was formed in 1861 by states that had seceded from the Union. The central conflict leading to war was a dispute over whether slavery should be permitted to expand into the western territories, leading to more slave states, or be prohibited from doing so, which many believed would place slavery on a course of ultimate extinction.
10.01.1812	The first steamboat on the Ohio River or the Mississippi River arrives in New Orleans, 82 days after departing from Pittsburgh.	New Orleans was the first steamboat on the western waters of the United States. Her 1811–1812 voyage from Pittsburgh, Pennsylvania, to New Orleans, Louisiana, on the Ohio and Mississippi rivers ushered in the era of commercial steamboat navigation on the western and mid-western continental rivers.
10.01.1791	The Siege of Dunlap's Station begins near Cincinnati during the Northwest Indian War.	The siege of Dunlap's Station was a battle that took place on January 10–11, 1791, during the Northwest Indian War between the Northwestern Confederacy of American Indians and European American settlers in what became the southwestern region of the U.S. state of Ohio. This was one of the Indians' few unsuccessful attacks during this period. It was shortly after the Harmar campaign attacks and unprecedented defeat of U.S. Army forces.
10.01.1776	American Revolution: Thomas Paine publishes his pamphlet Common Sense.	Thomas Paine was an English-born American Founding Father, French Revolutionary, inventor, political philosopher, and statesman. He authored Common Sense (1776) and The American Crisis (1776–1783), two of the most influential pamphlets at the start of the American Revolution, and he helped to inspire the colonial era patriots in 1776 to declare independence from Great Britain. His ideas reflected Enlightenment-era ideals of human rights.
10.01.1645	Archbishop William Laud is beheaded for treason at the Tower of London.	William Laud was a bishop in the Church of England. Appointed Archbishop of Canterbury by Charles I in 1633, Laud was a key advocate of Charles I's religious reforms; he was arrested by Parliament in 1640 and executed towards the end of the First English Civil War in January 1645.
10.01.1475	Stephen III of Moldavia defeats the Ottoman Empire at the Battle of Vaslui.	Stephen III, better known as Stephen the Great, was Voivode of Moldavia from 1457 to 1504. He was the son of and co-ruler with Bogdan II, who was murdered in 1451 in a conspiracy organized by his brother and Stephen's uncle Peter III Aaron, who took the throne. Stephen fled to Hungary, and later to Wallachia; with the support of Vlad III Țepeș, Voivode of Wallachia, he returned to Moldavia, forcing Aaron to seek refuge in Poland in the summer of 1457. Teoctist I, Metropolitan of Moldavia, anointed Stephen prince. He attacked Poland and prevented Casimir IV Jagiellon, King of Poland, from supporting Peter Aaron, but eventually acknowledged Casimir's suzerainty in 1459.
10.01.1430	Philip the Good, the Duke of Burgundy, establishes the Order of the Golden Fleece, the most prestigious, exclusive, and expensive order of chivalry in the world.	Philip III the Good ruled as Duke of Burgundy from 1419 until his death in 1467. He was a member of a cadet line of the House of Valois, to which all 15th-century kings of France belonged. During his reign, the Burgundian State reached the apex of its prosperity and prestige, and became a leading centre of the arts.
10.01.1072	Robert Guiscard conquers Palermo in Sicily for the Normans.	Robert Guiscard, also referred to as Robert de Hauteville, was a Norman adventurer remembered for his conquest of southern Italy and Sicily in the 11th century.
11.01.2020	COVID-19 pandemic in Hubei: Municipal health officials in Wuhan announce the first recorded death from COVID-19.	The COVID-19 pandemic in Hubei was the first identified outbreak of the COVID-19 virus. It emerged as a cluster of mysterious pneumonia cases in Wuhan, the provincial capital of Hubei, China. A Wuhan hospital initially notified the local Chinese Center for Disease Control and Prevention (CCDC) on December 27, 2019. By December 31, Wuhan CCDC confirmed a cluster of unknown pneumonia cases linked to the Huanan Seafood Wholesale Market after unverified documents appeared on the Internet. The outbreak got nationwide attention, with the National Health Commission (NHC) in Beijing sending medical experts to Wuhan the next day. On January 8, 2020, a new coronavirus was identified as the cause of the pneumonia. The sequence of the virus was published on an open-access database. The measures taken by the Chinese government have been controversial. They were praised by the World Health Organization (WHO) for improvements over their response to SARS-CoV-2. However, many in the international community criticized them for being deceptive, slow to publicly disclose key facts about the outbreak, and for aggressively censoring information related to the outbreak and public discontent from citizens online.
11.01.2013	One French soldier and 17 militants are killed in a failed attempt to free a French hostage in Bulo Marer, Somalia.	On 11 January 2013, the French military launched an unsuccessful operation in Bulo Marer, Lower Shabelle, Somalia to rescue French hostage Denis Allex from the militant Islamist organization al-Shabaab. Allex was executed in response, and two French commandos, at least 17 Islamist militants and at least eight civilians were killed in the firefight.
11.01.2003	Illinois Governor George Ryan commutes the death sentences of 167 prisoners on Illinois's death row based on the Jon Burge scandal.	The governor of Illinois is the head of government of Illinois, and the various agencies and departments over which the officer has jurisdiction, as prescribed in the state constitution. It is a directly elected position, votes being cast by popular suffrage of residents of the state. The governor is responsible for endorsing or vetoing laws passed by the Illinois General Assembly. The office also carries the power of pardon and commutation under state law. The governor is commander-in-chief of the state's land, air and sea forces when they are in state service. Illinois is one of 13 states that does not place a term limit for governor.
11.01.1998	Over 100 people are killed in the Sidi-Hamed massacre in Algeria.	The Sidi-Hamed massacre took place on the night of January 11, 1998, in the town of Sidi-Hamed, 30 km south of Algiers. An estimated fifty gunmen participated, attacking children and adults; they bombed a café where films were being watched and a mosque in nearby Haouche Sahraoui, killing those who fled, and entered houses to kill those within. According to official figures, 103 people were killed and 70 injured, including two pro-government fighters and five of the attackers. Other sources indicate a higher toll; AFP supposedly counted over 120 corpses, and some Algerian newspapers claimed 400. Thirty girls were reportedly kidnapped. The massacre was generally blamed on the Armed Islamic Group of Algeria (GIA). One newspaper claimed that survivors blamed it on the Islamic Salvation Front (AIS).
11.01.1996	Space Shuttle program: STS-72 launches from the Kennedy Space Center marking the start of the 74th Space Shuttle mission and the 10th flight of Endeavour.	The Space Shuttle program was the fourth human spaceflight program carried out by the U.S. National Aeronautics and Space Administration (NASA), which accomplished routine transportation for Earth-to-orbit crew and cargo from 1981 to 2011. Its official program name was Space Transportation System (STS), taken from a 1969 plan for a system of reusable spacecraft where it was the only item funded for development, as a proposed nuclear shuttle in the plan was cancelled in 1972. It flew 135 missions and carried 355 astronauts from 16 countries, many on multiple trips.
11.01.1995	51 people are killed in a plane crash in María La Baja, Colombia.	Intercontinental de Aviación Flight 256 (RS256/ICT256) was a scheduled flight from El Dorado International Airport, Bogotá, on a service to Rafael Núñez International Airport, Cartagena, and San Andrés. On 11 January 1995, the McDonnell Douglas DC-9-14 operating the flight crashed during its approach to Cartagena Airport, killing all but one of the 52 people on board. The sole survivor was a nine-year old girl who sustained minor injuries.
11.01.1994	The Irish Government announces the end of a 15-year broadcasting ban on the IRA and its political arm Sinn Féin.	Ireland, also known as the Republic of Ireland, is a country in Northwestern Europe. It consists of 26 of the 32 counties of the island of Ireland, with a population of about 5.4 million. Its capital and largest city is Dublin, on the eastern side of the island, with a population of over 1.5 million. The sovereign state shares its only land border with Northern Ireland, which is part of the United Kingdom. It is otherwise surrounded by the Atlantic Ocean, with the Celtic Sea to the south, St George's Channel to the south-east and the Irish Sea to the east. It is a unitary, parliamentary republic. The legislature, the Oireachtas, consists of a lower house, Dáil Éireann; an upper house, Seanad Éireann; and an elected president who serves as the largely ceremonial head of state, but with some important powers and duties. The head of government is the Taoiseach, elected by the Dáil and appointed by the president, who appoints other government ministers.
11.01.1986	The Gateway Bridge, Brisbane, Queensland, Australia is officially opened.	The Sir Leo Hielscher Bridges, formerly and still collectively referred to as the Gateway Bridge, are a pair of twin road bridges that carry the Gateway Motorway (M1) over the Brisbane River, skirting the eastern suburbs of the city of Brisbane. The western bridge carries traffic to the north and the eastern bridge carries traffic to the south. They are the most eastern crossings of the Brisbane River and the closest to Moreton Bay, crossing at the Quarries Reach and linking the suburbs of Eagle Farm and Murarrie. The original western bridge was opened on 11 January 1986 and cost A$92 million to build. The duplicate bridge was opened in May 2010, and cost $350 million.
11.01.1983	United Airlines Flight 2885 crashes after takeoff from Detroit Metropolitan Airport, killing three.	United Airlines Flight 2885 was a scheduled cargo flight from Cleveland to Los Angeles, with stopover in Detroit. On January 11, 1983, a DC-8 operating as Flight 2885 crashed after take-off from Detroit, killing all three crew members. The National Transportation Safety Board (NTSB) investigation determined that the cause for the crash was pilot error. A radioactive package was found on board, but no radioactive material was spilled.
11.01.1973	Major League Baseball owners vote in approval of the American League adopting the designated hitter position.	Major League Baseball (MLB) is a professional baseball league in North America composed of 30 teams, divided equally between the National League (NL) and the American League (AL), with 29 in the United States and 1 in Canada. MLB is one of the major professional sports leagues in the United States and Canada and is considered the premier professional baseball league in the world. Each team plays 162 games per season, with Opening Day held during the last week of March or the first week of April. Six teams in each league then advance to a four-round postseason tournament in October, culminating in the World Series, a best-of-seven championship series between the two league champions first played in 1903. MLB is headquartered in Midtown Manhattan.
11.01.1972	East Pakistan renames itself Bangladesh.	"East Pakistan was the eastern province of Pakistan between 1956 and 1971, restructured and renamed from the province of East Bengal and covering the territory of the modern country of Bangladesh. Its land borders were with India and Burma, with a coastline on the Bay of Bengal. East Pakistanis were popularly known as ""Pakistani Bengalis""; to distinguish this region from India's state West Bengal, East Pakistan was known as ""Pakistani Bengal"". In 1971, East Pakistan became the newly independent state Bangladesh, which means ""country of Bengal"" or ""country of Bengalis"" in the Bengali language."
11.01.1966	The Tbilisi Metro is opened.	The Tbilisi Metro is a rapid transit system in the Georgian capital Tbilisi. Opened on 11 January 1966, it was the fourth metro system in the former Soviet Union. Like other ex-Soviet metros, most of the stations are very deep and vividly decorated.
11.01.1964	Surgeon General of the United States Dr. Luther Terry, M.D., publishes the landmark report Smoking and Health: Report of the Advisory Committee to the Surgeon General of the Public Health Service saying that smoking may be hazardous to health, sparking national and worldwide anti-smoking efforts.	The surgeon general of the United States is the operational head of the United States Public Health Service Commissioned Corps (PHSCC) and thus the leading spokesperson on matters of public health in the federal government of the United States. The surgeon general's office and staff are known as the Office of the Surgeon General (OSG), which is housed within the Office of the Assistant Secretary for Health.
11.01.1962	Cold War: While tied to its pier in Polyarny, the Soviet submarine B-37 is destroyed when fire breaks out in its torpedo compartment.	The Cold War was a period of global geopolitical rivalry between the United States (US) and the Soviet Union (USSR) and their respective allies, the capitalist Western Bloc and communist Eastern Bloc, which began in the aftermath of the Second World War and ended with the dissolution of the Soviet Union in 1991. The term cold war is used because there was no direct fighting between the two superpowers, though each supported opposing sides in regional conflicts known as proxy wars. In addition to the struggle for ideological and economic influence and an arms race in both conventional and nuclear weapons, the Cold War was expressed through technological rivalries such as the Space Race, espionage, propaganda campaigns, embargoes, and sports diplomacy.
11.01.1962	An avalanche on Huascarán in Peru causes around 4,000 deaths.	Huascarán, , Nevado Huascarán or Mataraju is a mountain located in Yungay Province, Ancash Department, Peru. It is situated in the Cordillera Blanca range of the western Andes. The southern summit of Huascarán, which reaches 6,768 metres (22,205 ft), is the highest point in Peru, the northern Andes, and in all of the Earth's tropics. It is the 4th highest mountain in South America after Aconcagua, Ojos del Salado, and Monte Pissis. Huascarán is ranked 25th by topographic isolation.
11.01.1961	Throgs Neck Bridge over the East River, linking New York City's boroughs of The Bronx and Queens, opens to road traffic.	The Throgs Neck Bridge is a suspension bridge in New York City, carrying six lanes of Interstate 295 (I-295) over the East River where it meets the Long Island Sound. The bridge connects the Throggs Neck section of the Bronx with the Bay Terrace section of Queens.
11.01.1959	36 people are killed when Lufthansa Flight 502 crashes on approach to Rio de Janeiro/Galeão International Airport in Brazil.	Lufthansa Flight 502 was a scheduled flight from Hamburg, Germany to Buenos Aires, Argentina on 11 January 1959. The flight was being operated by a Lockheed L-1049G Super Constellation. On the leg between Senegal and Brazil the Super Constellation was on approach to Rio de Janeiro–Galeão International Airport when it crashed near Flecheiras Beach just short of the runway. All 29 passengers and seven of the ten crew were killed. It was the first fatal accident involving the current Lufthansa since it was formed in 1955.
11.01.1957	The African Convention is founded in Dakar, Senegal.	African Convention was a political party in French West Africa, originally formed at a meeting in Dakar on 11 January 1957. The CA consisted of the Senegalese Popular Bloc (BPS) of Léopold Sédar Senghor, the African Popular Movement of Nazi Boni in Upper Volta, and the Nigerien Democratic Front (FDN) of Zodi Ikhia in Niger.
11.01.1949	"The first ""networked"" television broadcasts took place as KDKA-TV in Pittsburgh, Pennsylvania goes on the air connecting the east coast and mid-west programming."	"KDKA-TV, branded CBS Pittsburgh, is a television station in Pittsburgh, Pennsylvania, United States. It is owned and operated by the CBS television network through its CBS News and Stations division alongside WPKD-TV, an independent station. The two stations share studios at the Gateway Center in Downtown Pittsburgh; KDKA-TV's transmitter is located in the city's Perry North neighborhood. KDKA-TV, along with sister station KYW-TV in Philadelphia, are the only CBS-affiliated television stations east of the Mississippi River with ""K"" call signs."
11.01.1946	Enver Hoxha, Secretary General of the Communist Party of Albania, declares the People's Republic of Albania with himself as head of state.	Enver Halil Hoxha was an Albanian communist revolutionary and statesman who was the leader of Albania from 1944 until his death in 1985. He was the First Secretary of the Party of Labour of Albania from 1941 until his death, a member of its Politburo, chairman of the Democratic Front of Albania, and commander-in-chief of the Albanian People's Army. He was the twenty-second prime minister of Albania from 1944 to 1954 and at various times was both foreign minister and defence minister of the country.
11.01.1943	The Republic of China agrees to the Sino-British New Equal Treaty and the Sino-American New Equal Treaty.	The Republic of China (ROC) began on 1 January 1912 as a sovereign state in mainland China following the 1911 Revolution, which overthrew the Manchu-led Qing dynasty and ended China's imperial history. From 1927, the Kuomintang (KMT) reunified the country and initially ruled it as a one-party state with Nanjing as the national capital. In 1949, the KMT-led government was defeated in the Chinese Civil War and lost control of the mainland to the Chinese Communist Party (CCP). The CCP established the People's Republic of China (PRC) while the ROC was forced to retreat to Taiwan; the ROC retains control over the Taiwan Area, and its political status remains disputed. The ROC is recorded as a founding member of both the League of Nations and the United Nations, and previously held a permanent seat on the United Nations Security Council until 1971, when the PRC took China's seat in the United Nations General Assembly Resolution 2758. It was also a member of the Universal Postal Union and the International Olympic Committee. The ROC claimed 11.4 million km2 (4.4 million sq mi) of territory, and its population of 541 million in 1949 made it the most populous country in the world.
11.01.1943	Italian-American anarchist Carlo Tresca is assassinated in New York City.	Carlo Tresca was an Italian-American dissident, newspaper editor, orator, and labor organizer and activist who was a leader of the Industrial Workers of the World during the 1910s. He is remembered as a leading public opponent of fascism, Stalinism, and Mafia infiltration of the trade unions for the purposes of labor racketeering and corruption.
11.01.1942	World War II: Japanese forces capture Kuala Lumpur, the capital of the Federated Malay States.	World War II or the Second World War was a global conflict between two coalitions: the Allies and the Axis powers. Nearly all of the world's countries participated, with many nations mobilising all resources in pursuit of total war. Tanks and aircraft played major roles, enabling the strategic bombing of cities and delivery of the first and only nuclear weapons ever used in war. World War II is the deadliest conflict in history, causing the death of 70 to 85 million people, more than half of whom were civilians. Millions died in genocides, including the Holocaust, and by massacres, starvation, and disease. After the Allied victory, Germany, Austria, Japan, and Korea were occupied, and German and Japanese leaders were tried for war crimes.
